{
  "dataset_schema_version": "1.0",
  "run_id": "draft-run-v1-native-r1",
  "serialNumber": "VM-001",
  "hardware_unit_id": "ESP32_1",
  "vehicle_role": "legitimate",
  "seq": 123,
  "active_vehicle_count": 1,
  "concurrency_mode": "single_legitimate",
  "t_sched_us": 13300000,
  "t_send_us": 13300120,
  "t_ack_rx_us": 13305120,
  "lateness_us": 120,
  "send_status": "on_time",
  "send_failure_reason": null,
  "echo_status": "ok",
  "skip_reason": "none",
  "payload_schema_version": "0.1",
  "application_payload_size_bytes": 120,
  "encoded_message_size_bytes": 120,
  "attack_window_active": false,
  "attack_id": null,
  "warmup_excluded_from_latency_stats": false,
  "active_attacker_count": 0
}
